{
  "id": "de-a1-b2",
  "schemaVersion": 1,
  "version": "1.0.0",
  "title": {
    "vi": "Tiếng Đức qua câu — A1 đến B2",
    "en": "German through sentences — A1 to B2"
  },
  "description": {
    "vi": "Học tiếng Đức bằng cả câu trọn vẹn thay vì từ rời. Mỗi câu kèm phiên âm theo tiếng Việt, nghĩa, điểm ngữ pháp và chú thích từ vựng.",
    "en": "Learn German through whole sentences rather than isolated words. Every sentence carries a Vietnamese-style transliteration, a meaning, a grammar point and word notes."
  },
  "targetLanguage": "de",
  "sourceLanguage": "vi",
  "levelFramework": "CEFR",
  "levelFrom": "A1",
  "levelTo": "B2",
  "levels": ["A1", "A2", "B1", "B2"],
  "primaryItemKind": "sentence",
  "fields": [
    { "key": "text", "role": "prompt", "required": true, "label": { "vi": "Câu tiếng Đức", "en": "German sentence" } },
    { "key": "meaning", "role": "answer", "required": true, "label": { "vi": "Nghĩa tiếng Việt", "en": "Vietnamese meaning" } },
    { "key": "transliteration", "role": "hint", "display": "toggle", "label": { "vi": "Phiên âm (đọc theo tiếng Việt)", "en": "Vietnamese-style transliteration" } },
    { "key": "grammarNote", "role": "note", "label": { "vi": "Điểm ngữ pháp", "en": "Grammar point" } },
    {
      "key": "sentenceType",
      "role": "tag",
      "label": { "vi": "Loại câu", "en": "Sentence type" },
      "enum": [
        "declarative",
        "question",
        "yes_no_question",
        "negative",
        "imperative",
        "exclamation",
        "compound",
        "subordinate",
        "answer",
        "passive",
        "enumeration"
      ]
    }
  ],
  "glossaryFields": [
    {
      "key": "gender",
      "role": "badge",
      "colorCoded": true,
      "label": { "vi": "Giống (Artikel)", "en": "Noun gender" },
      "enum": ["der", "die", "das"]
    }
  ],
  "tts": { "lang": "de-DE", "rate": 0.9 },
  "source": {
    "name": "Customized Learning Deustch.xlsx",
    "note": "1800 dòng gốc, trong đó 600 dòng (S0001–S0600) có nội dung. 1200 dòng S0601–S1800 là khung trống, sẽ bổ sung sau."
  }
}
